{"completed_at":"2026-08-24T23:14:41Z","decision":"approve","findings":[{"due_date":null,"id":"WV-SEC-001","owner":null,"severity":"high","status":"resolved","summary":"Repeated graph traversal denial of service was resolved with indexed reachability and cached dominators.","tracking_url":null},{"due_date":null,"id":"WV-SEC-002","owner":null,"severity":"medium","status":"resolved","summary":"Plain scalar continuations are no longer misclassified as YAML block scalar headers.","tracking_url":null},{"due_date":null,"id":"WV-SEC-003","owner":null,"severity":"low","status":"resolved","summary":"Self-referential release evidence was replaced by a verified two-commit evidence model.","tracking_url":null},{"due_date":null,"id":"WV-SEC-004","owner":null,"severity":"low","status":"resolved","summary":"Dune install symlinks are materialized into validated regular files without weakening release package input checks.","tracking_url":null}],"maintainer":"P4suta","planned_tag":"v0.1.0","residual_risks":[],"review":"https://github.com/P4suta/workflow-verifier/pull/4","schema":"maintainer-security-attestation-v1","scope":["authorization-dominance","canonical-protocols-and-evidence-hash-chains","dependency-resolution-redirects-and-allowlists","fix-proof-obligations","native-containment-backends","untrusted-and-secret-dataflow","yaml-parser-and-expression-denial-of-service"],"subject_commit":"e1e47253d66fb34f8d9c9b5b18d8874f700f109c"}
